,contentid,contenttypeid,title,overview,firstimage,addr1,mapx,mapy,tags,tokens,contenttypeid_tag
551,2542529,80,Seongyojang [Korea Quality] / 강릉선교장 [한국관광 품질인증],"
Seongyojang House was built by Yi Nae-beon (pen-name: Mugyeong), an 11th-generation descendant of Grand Prince Hyoryeong (the elder brother of King Sejong the Great), and has been repaired and extended numerous times over the last ten generations. 
The house is composed of a variety of rooms and buildings of different sizes, and there are twelve gates between its many buildings, which include 3 ‘Byeoldang’ rooms (Dong, Seo, and Oe), Sarangchae, Jungsarang, Haengangchae, and Sadang. 
Seongyojang House is well known as one of the largest and greatest houses in Korea in terms of the number and size of its buildings and its total land area among houses built at that time. Interestingly, Seongyojang was built to such a great size due to the influence of the classical poem Gwandongbyeolgok (about the Beautiful Scenery of Gwandong, present-day Gangwon-do, in 1580) written by Jeong Cheol (1536-1593, pen-name: Songgang). Because of the popularity of this poem, a cultural trend emerged in which noblemen of the late Joseon Dynasty felt compelled to visit the Gwandong (present-day Gangwon-do) area at least once in their lifetime, and Seongyojang was a must-see attraction. 
The house experienced a crisis when only three people were staying in this vast building. However, the director of the house, Lee Kang-baek, strived to save his ancestors’ invaluable heritage and finally received the necessary administrative support. Thanks to that, all the toilets and shower facilities were modernized, and Seongyojang House now offers both the beauty of a traditional hanok building and convenient modern facilities for all its guests. 
Seongyojang has many wonderful structures including Hwallaejeong Pavilion, one of its most charming structures; Yeolhwadang, which was given as a gift to the Russian Consulate; Yeonjidang, which was built in an elegant style; and Seobyeoldang. In particular, the signboard of Hwallaejeong was changed and rewritten regularly by members of the Joseon literati who stayed in the house. The most famous version of the signboard was written by Gim Jeong-hui (1786-1856, pen-name: Chusa).
",http://tong.visitkorea.or.kr/cms/resource/23/2578923_image2_1.jpg,"63, Unjeong-gil, Gangneung-si, Gangwon-do",128.8846278304,37.7871087953,seongyojang house yi naebeon penname mugyeong thgeneration descendant grand prince hyoryeong elder brother king sejong great repaired extended numerous times last ten generations house composed variety rooms buildings different sizes twelve gates buildings byeoldang rooms dong seo oe sarangchae jungsarang haengangchae sadang seongyojang house known largest greatest houses terms number size buildings total land among houses time interestingly seongyojang great size due influence classical poem gwandongbyeolgok beautiful scenery gwandong presentday gangwondo written jeong cheol penname songgang popularity poem cultural trend emerged noblemen late joseon dynasty felt compelled gwandong presentday gangwondo least lifetime seongyojang mustsee attraction house experienced crisis three people staying vast building however director house lee kangbaek strived save ancestors invaluable heritage finally received necessary administrative support thanks toilets shower facilities modernized seongyojang house beauty traditional hanok building convenient modern facilities guests seongyojang wonderful structures hwallaejeong pavilion charming structures yeolhwadang given gift russian consulate yeonjidang elegant style seobyeoldang particular signboard hwallaejeong changed rewritten regularly members joseon literati stayed house famous version signboard written gim jeonghui penname chusa,"['accommodation', 'seongyojang', 'house', 'penname', 'buildings', 'signboard']",accommodation
552,658343,76,Seorak Cable Car (설악산 케이블카),"The ideal way to comfortably appreciate the magnificent landscape of Seoraksan Mountain is using the Seorak Cable Car. The cable car boarding station is located in the Small Park of Seoraksan National Park. It takes about 10 min to get to the Gwongeumseong Fortress (700m above sea level) by the cable car. One-way ticket is not available, so visitors need to buy a round-trip ticket. Visitors can also enjoy an open view of various famous attractions such as Ulsan Peak and Manmulsang Rocks beyond glass window in the cable car. The Gwongeumseong Fortress, unfolding a panoramic view of Seoraksan Mountain’s majestic scenery, bears a legend in which two generals Gwon and Kim built the fortress in one day to prevent enemy invasion during the Goryeo period. Today, the site of the fortress only remains. Many hikers come up to the summit of the fortress despite its rough course to appreciate magnificent and mysterious scenery of strange rocks and bizarre stones at Seoraksan Mountain. When you are at the summit, you can see the landscape of not only the Outer Seorak but also the Inner Seorak. Below the Gwongeumseong Fortress are Allagam Hermitage built during the Silla period and Muhaksong (Korean red pine) existed for hundreds of years. As many tourists visit the mountain at weekends and during public holidays and autumn foliage season, it is recommended to schedule your trip by considering the waiting time too.",,"1085, Seoraksan-ro, Sokcho-si, Gangwon-do",128.4890711013,38.1730535382,ideal comfortably appreciate magnificent landscape seoraksan mountain using seorak cable car cable car boarding station small park seoraksan national park takes min get gwongeumseong fortress sea level cable car oneway ticket available visitors need buy roundtrip ticket visitors open view famous attractions ulsan peak manmulsang rocks beyond glass window cable car gwongeumseong fortress unfolding panoramic view seoraksan mountains majestic scenery bears legend generals gwon kim fortress day prevent enemy invasion goryeo period today fortress remains hikers come summit fortress despite rough course appreciate magnificent mysterious scenery strange rocks bizarre stones seoraksan mountain summit see landscape outer seorak inner seorak gwongeumseong fortress allagam hermitage silla period muhaksong korean red pine existed hundreds years tourists mountain weekends public holidays autumn foliage season recommended schedule trip considering waiting time,"['nature', 'fortress', 'cable', 'gwongeumseong', 'car', 'seoraksan']",nature
553,266864,75,Seorak Plaza Country Club (설악프라자컨트리클럽),"Seorak Plaza Country Club is located in the beautiful environment of Sokcho on Korea's eastern coast. The Mountain View Course showcases Seoraksan National Park, while the Sunrise View Course overlooks the East Sea.",http://tong.visitkorea.or.kr/cms/resource/73/1947473_image2_1.jpg,"1111, Misiryeong-ro 2983beon-gil, Sokcho-si, Gangwon-do",128.528324721,38.2098694575,seorak plaza country club beautiful environment sokcho koreas eastern coast mountain view course showcases seoraksan national park sunrise view course overlooks east sea,"['activity', 'course', 'showcases', 'view', 'overlooks', 'plaza']",activity
554,1963096,76,Seorak Special Tourist Zone (설악 관광특구),"Seorak Special Tourist Zone is a vast zone included in 3 administrative districts, encompassing the entirety of Seoraksan Mountain. In this zone, visitors have various ways to enjoy Seoraksan Mountain and the natural environment of the East Sea region. 
Sokcho, which occupies the largest area in the zone, comes first when talking about Seoraksan National Park. Tourists can appreciate the picturesque scenery of the sea and coastal lakes as well as the mountain scenery of Seoraksan Mountain. Hikers can climb the mountain or ride a cable car. Sokcho Beach is a hot spot that attracts young people who fill the place with energy and life all through the summer. 
Abai Village, which appeared in several TV dramas for its unique atmosphere, and Sokcho Jungang Market offer local specialties, such as abai sundae (Korean sausage) and dak gangjeong (glazed fried chicken  bites). 
Goseong, which is bordered by Seoraksan Mountain and Geumgangsan Mountain, is part of the Northern Limit Line (NLL) that offers a unpolluted, beautiful landscape around the Demilitarized Zone (DMZ). Hwajinpo Beach near Hwajinpo Lake, which is a lagoon, and Songjiho Beach near Songjiho Lake are the best places to spend a peaceful vacation. At Hwajinpo Lake, tourists can visit the summer house used by the first South Korean President Syngman Rhee and Castle of Hwajinpo, visited by the former North Korean leader Kim Il-sung before the division of the Korean Peninsula. Lastly, although it is a relatively small part of Seorak Special Tourist Zone, Yangyang has resources for mountain tourism and maritime culture, such as Seoraksan National Park and Naksan Provincial Park. Naksan Beach, Naksansa Temple and Hajodae are popular tourist sites. It is also famous as a district producing high quality pine mushroom. 

* Current State of Seorak Special Tourist Zone
1) Districts Covered: Areas around Sokcho-si and parts of Goseong and Yangyang-gun, Gangwon-do
2) Area: 138.2k㎡(Sokcho 104.9k㎡, Goseong 30.5k㎡, Yangyang 2.8k㎡) 

* Tourist Attractions 
Seoraksan National Park, Sokcho Beach, Naksan Provincial Park, Hwajinpo Lake, Songjiho Lake, Hajodae Pavilion, Naksansa Temple, Osaek Mineral Spring, etc. ",http://tong.visitkorea.or.kr/cms/resource/39/1950339_image2_1.jpg,"Sokcho-si, Gangwon-do",128.4241422719,38.1284602517,seorak special tourist zone vast zone included administrative districts encompassing entirety seoraksan mountain zone visitors ways seoraksan mountain natural environment east sea region sokcho occupies largest zone comes first talking seoraksan national park tourists appreciate picturesque scenery sea coastal lakes mountain scenery seoraksan mountain hikers climb mountain ride cable car sokcho beach spot attracts young people fill place energy life summer abai village appeared several tv dramas unique atmosphere sokcho jungang market offer local specialties abai sundae korean sausage dak gangjeong glazed fried chicken bites goseong bordered seoraksan mountain geumgangsan mountain part northern limit line nll unpolluted beautiful landscape demilitarized zone dmz hwajinpo beach hwajinpo lake lagoon songjiho beach songjiho lake best places spend peaceful vacation hwajinpo lake tourists summer house used first south korean president syngman rhee castle hwajinpo visited former north korean leader kim ilsung division korean peninsula lastly although relatively small part seorak special tourist zone yangyang resources mountain tourism maritime culture seoraksan national park naksan provincial park naksan beach naksansa temple hajodae popular tourist sites famous district producing high quality pine mushroom current state seorak special tourist zone districts covered areas sokchosi goseong yangyanggun gangwondo ksokcho k goseong k yangyang k tourist attractions seoraksan national park sokcho beach naksan provincial park hwajinpo lake songjiho lake hajodae pavilion naksansa temple osaek mineral spring etc,"['nature', 'zone', 'hwajinpo', 'seoraksan', 'mountain', 'songjiho']",nature
555,658335,76,Seoraksan Daecheongbong Peak (설악 대청봉),"This 1,708 m-high peak is the highest peak of Seoraksan Mountain and the third highest in the Republic of Korea, behind Hallasan Mountain (1,950 m) and Jirisan Mountain (1,915 m). It is the centerpiece of the 40 km2-wide Seoraksan National Park and the dividing point between Naeseorak and Oeseorak areas: areas to the west of Daecheongbong Peak toward Inje are considered Naeseorak, while the areas to the east, toward Sokcho and Goseong, are considered as latter. It is also the origin of most of Seoraksan Mountain’s famous valleys, like Cheonbuldong and Gayadong Valleys. Because of erratic weather and low temperature, Daecheongbong Peak is often covered in snow from late October to late spring. Its ridges are populated by Siberian dwarf pine, Hairy Korean rhododendron, Erman's birch, and subalpine trees, making it a valuable source for alpine plant research. Four trails in the Seoraksan National Park take the visitors to this peak, through Osaek, Baekdam, Seorak-dong, and Osaengnyeong (Hangyeryeong) Pass. The shortest trail is the 5 km-long Osaek Trail (Osaek – Seorak Falls – Daecheongbong Peak), taking about 4 hr in total. The management controls entry to Seoraksan National Park depending on weather conditions and period, so visitors are advised to check the real-time information provided at its webpage (www.knps.or.kr).",,"Seoraksan-ro, Yangyang-gun, Gangwon-do",128.4588238001,38.0849548701,mhigh peak highest peak seoraksan mountain third highest republic behind hallasan mountain jirisan mountain centerpiece kmwide seoraksan national park dividing point naeseorak oeseorak areas areas west daecheongbong peak toward inje considered naeseorak areas east toward sokcho goseong considered latter origin seoraksan mountains famous valleys cheonbuldong gayadong valleys erratic weather low temperature daecheongbong peak often covered snow late october late spring ridges populated siberian dwarf pine hairy korean rhododendron ermans birch subalpine trees valuable source alpine plant research four trails seoraksan national park take visitors peak osaek baekdam seorakdong osaengnyeong hangyeryeong pass shortest trail osaek trail osaek seorak falls daecheongbong peak taking hr total management controls entry seoraksan national park depending weather conditions period visitors advised check realtime information provided webpage wwwknpsorkr,"['nature', 'peak', 'seoraksan', 'osaek', 'daecheongbong', 'toward']",nature
556,264219,76,Seoraksan National Park (Inner Section) (설악산국립공원 (내설악)),"Daecheongbong Peak in Seoraksan Mountain, at an altitude of 1,708 meters, is the highest peak among the Taebaek Mountain Range, providing amazing view all year round. With various flowers in spring, clear and fresh stream water in summer, fall foliage in fall, and snow covered mountain in winter, Seoraksan Mountain is the most beautiful mountain in Korea.
The inner section (""Naeseorak"") of the mountain stretches from the borderline of Hangyeryeong Pass and Misiryeong Pass to Inje-gun in the west. There are various valleys and waterfalls not to be missed as well as several hiking courses that represent the mountain.",http://tong.visitkorea.or.kr/cms/resource/43/780843_image2_1.jpg,"Buk-myeon, Inje-gun, Gangwon-do",128.2041596126,38.1247314602,daecheongbong peak seoraksan mountain altitude highest peak among taebaek mountain range providing amazing view year round flowers spring clear fresh stream water summer fall foliage fall snow covered mountain winter seoraksan mountain beautiful mountain inner section naeseorak mountain stretches borderline hangyeryeong pass misiryeong pass injegun west valleys waterfalls missed several hiking courses represent mountain,"['nature', 'mountain', 'fall', 'pass', 'peak', 'seoraksan']",nature
557,264211,76,Seoraksan National Park (Outer Section) (설악산 국립공원 (외설악)),"Seoraksan Mountain is one of Korea's most famous tourist destinations that stretches across several areas including Sokcho, Goseong, Inje, and Yangyang in Gangwon-do. It was designated as Korea's fifth national park in 1970 after the designation of Hallyeohaesang National Park, and as Korea's first UNESCO Biosphere Reserve in 1982. It has been also registered in the IUCN Green List of Protected and Conserved Areas, which is the global standard of best practice for area-based conservation. Having Daecheongbong Peak as the mountain's main peak, Seoraksan National Park, with a total area of 398 km², is divided  into the outer section (""Oeseorak,"" eastern section), the inner section (""Naeseorak,"" western section), and the southern section (""Namseorak""). Daecheongbong Peak (1,708 m) is the third highest peak in Korea after Hallasan Mountain and Jirisan Mountain, and as the peak is covered with snow for five to six months of the year, the mountain got the name ""Seorak"" (meaning a snowy peak). The summit of Daecheongbong Peak commands the magnificent natural landscape of Seoraksan Mountain and the East Sea. In particular, it is known for the fantastic views of the sunrise and sunset. In addition to Daecheongbong Peak, Seoraksan Mountain has some 30 grand peaks, such as Socheongbong, Hwachaebong, and Jungcheongbong. The mountain is also full of hidden scenic views of Biryongpokpo Falls, Ulsan Peak, Heundeulbawi Rock, and Geumganggul Cave. By using the cable car near Seoraksan Small Park, the disabled and the elderly can go up to the top and enjoy a panoramic view of the mountain.",,"Seoraksan-dong, Sokcho-si, Gangwon-do",128.4944400775,38.172403718,seoraksan mountain koreas famous tourist destinations stretches across several areas sokcho goseong inje yangyang gangwondo designated koreas fifth national park designation hallyeohaesang national park koreas first unesco biosphere reserve registered iucn green list protected conserved areas global best practice areabased conservation daecheongbong peak mountains main peak seoraksan national park total km divided outer section oeseorak eastern section inner section naeseorak western section southern section namseorak daecheongbong peak third highest peak hallasan mountain jirisan mountain peak covered snow five six months year mountain got seorak snowy peak summit daecheongbong peak commands magnificent natural landscape seoraksan mountain east sea particular known fantastic views sunrise sunset addition daecheongbong peak seoraksan mountain grand peaks socheongbong hwachaebong jungcheongbong mountain full hidden scenic views biryongpokpo falls ulsan peak heundeulbawi rock geumganggul cave using cable car seoraksan small park disabled elderly go top panoramic view mountain,"['nature', 'peak', 'section', 'daecheongbong', 'mountain', 'seoraksan']",nature
558,1758437,76,Seoraksan National Park (Southern Section) (설악산국립공원 (남설악)),"Seoraksan Mountain, the highest amid the Taebaek Mountain Range, boasts beautiful landscape and scenery all year round. To the east of Hangyeryeong and Misiryeong Passes is classified as the outer section (""Oeseorak""), to the west is the inner section (""Naeseorak""); and to the south of Hangyeryeong Pass as the southern section (""Namseorak"").
The southern section is famous for its mineral water, hot springs, and waterfalls including Yongsopokpo, Sibipokpo, and Yeosinpokpo Falls. Jeongbongsan Mountain (1,424.2 meters) is also included in the area. There are also several different hiking courses varying in distance and duration.",http://tong.visitkorea.or.kr/cms/resource/46/652646_image2_1.jpg,"801, Seorak-ro, Yangyang-gun, Gangwon-do",128.3019017658,38.1809851152,seoraksan mountain highest amid taebaek mountain range boasts beautiful landscape scenery year round east hangyeryeong misiryeong passes classified outer section oeseorak west inner section naeseorak south hangyeryeong pass southern section namseorak southern section famous mineral water springs waterfalls yongsopokpo sibipokpo yeosinpokpo falls jeongbongsan mountain included several different hiking courses varying distance duration,"['nature', 'section', 'hangyeryeong', 'southern', 'mountain', 'classified']",nature
559,651303,78,Seoraksan National Park Visitor Center (설악산 탐방안내소),"Seoraksan National Park Visitor Center provides comprehensive information on the national park for visitors, and serves as a cultural center. Themed exhibits are presented throughout the building to promote environmental awareness about the park&rsquo;s special ecology.&nbsp;",http://tong.visitkorea.or.kr/cms/resource/71/647171_image2_1.jpg,"833, Seoraksan-ro, Sokcho-si, Gangwon-do",128.5173353857,38.1670797807,seoraksan national park visitor center comprehensive information national park visitors serves cultural center themed exhibits presented throughout building promote environmental awareness parkrsquos special ecologynbsp,"['culture', 'national', 'ecologynbsp', 'parkrsquos', 'center', 'presented']",culture
560,2693988,82,seunghye Sikdang (승혜식당),"It is a place where you can enjoy squid and Sundae. This restaurant's signature menu is stuffed squid. This Korean dishes restaurant is located in Gangneung-si, Gangwon-do.",http://tong.visitkorea.or.kr/cms/resource/56/2684856_image2_1.jpg,"24-2, Jungangsijang-gil, Gangneung-si, Gangwon-do",128.8990831152,37.753762935,place squid sundae restaurants signature menu stuffed squid korean dishes restaurant gangneungsi gangwondo,"['food', 'squid', 'sundae', 'stuffed', 'signature', 'restaurants']",food
561,2470515,76,Seungilgyo Bridge (승일교),"Seungilgyo Bridge is unique in that it was jointly built by South and North Korea. The construction began when the land belonged to North Korea, but after the Armstice Agreement the land was given to the South, who then complete the bridge. The bridge was designated as a Registerd Cultural Property No. 26 on May 31, 2002.",,"Area of Naedae-ri, Galmal-eup, Cheorwon-gun, Gangwon-do",127.3072124868,38.1669541327,seungilgyo bridge unique jointly south north construction began land belonged north armstice agreement land given south complete bridge bridge designated registerd cultural property may,"['nature', 'bridge', 'land', 'south', 'north', 'registerd']",nature
562,264217,76,Sibiseonnyeotang (Tangsudonggyegok Valley) (십이선녀탕(탕수동계곡)),"Sibiseonnyeotang Valley (Valley of the Twelve Angels’ Bath) is a beautiful valley filled with water flowing through a cascade of waterfalls and pools. In the past, there were 12 of each, although the size and shape has changed over time. The valley also features many uniquely shaped rocks and a forest comprised of many types of trees, including maple, pine nut, and pine trees. The path passing through the V-shaped valley crosses the stream often, so visiting after heavy rainfall is not recommended.",http://tong.visitkorea.or.kr/cms/resource/12/1583412_image2_1.jpg,"Sibiseonnyeotang-gil, Inje-gun, Gangwon-do",128.3015656324,38.1827015755,sibiseonnyeotang valley valley twelve angels bath beautiful valley filled water flowing cascade waterfalls pools past although size shape changed time valley features uniquely shaped rocks forest comprised types trees maple pine nut pine trees path passing vshaped valley crosses stream often visiting heavy rainfall recommended,"['nature', 'valley', 'trees', 'pine', 'rainfall', 'cascade']",nature
563,1684833,82,Sigol Makguksu (시골막국수),"Sigol Makguksu specializes in Chuncheon’s signature dish makguksu (spicy buckwheat noodles). Preserving a proud culinary tradition of over 30 years, Sigol Makguksu serves some of the area’s finest noodles as well as pyeonyuk (slices of boiled meat) and traditional tofu dishes. The restaurant is located in Sinbuk-eup past the Yeougogae Pass to the north of downtown Chuncheon.",,"100, Yulmun-gil, Chuncheon-si, Gangwon-do",127.7486682334,37.9246822519,sigol makguksu specializes chuncheons signature dish makguksu spicy buckwheat noodles preserving proud culinary tradition years sigol makguksu serves areas finest noodles pyeonyuk slices boiled meat traditional tofu dishes restaurant sinbukeup past yeougogae pass north downtown chuncheon,"['food', 'makguksu', 'sigol', 'noodles', 'pyeonyuk', 'finest']",food
564,2694082,82,Siingwa Bada (시인과바다),"It is a place where you can enjoy various types of coffee and desserts. This cafe is located in Gangneung-si, Gangwon-do. The most famous menu is americano.",http://tong.visitkorea.or.kr/cms/resource/76/2684876_image2_1.jpg,"1887, Haean-ro, Gangneung-si, Gangwon-do",128.8337817011,37.8997558693,place types coffee desserts cafe gangneungsi gangwondo famous menu americano,"['food', 'americano', 'desserts', 'coffee', 'cafe', 'types']",food
565,2694090,82,Sikgaek - Gyodong Branch (식객교동),"It is a place where you can enjoy Korean BBQ. The best menu at this restaurant is grilled skin-on pork belly. This Korean dishes restaurant is located in Gangneung-si, Gangwon-do.",http://tong.visitkorea.or.kr/cms/resource/77/2684877_image2_1.jpg,"22, Yulgokchogyo-gil 39beon-gil, Gangneung-si, Gangwon-do",128.8808594038,37.7651862584,place korean bbq best menu restaurant grilled skinon pork belly korean dishes restaurant gangneungsi gangwondo,"['food', 'skinon', 'belly', 'bbq', 'restaurant', 'pork']",food
566,2654949,82,Siksasigan (식사시간),"This is a Korean cuisine located in Wonju-si, Gangwon-do. The representative menu is sausage stew. Budaejjigae (spicy sausage stew) broth is simply delicious.",http://tong.visitkorea.or.kr/cms/resource/41/2652841_image2_1.jpg,"17-3, Geongang-ro, Wonju-si, Gangwon-do",127.9887169095,37.3259478085,korean cuisine wonjusi gangwondo representative menu sausage stew budaejjigae spicy sausage stew broth simply delicious,"['food', 'sausage', 'stew', 'simply', 'budaejjigae', 'broth']",food
567,2673329,82,SILLA ISABU DOKDO TUNA (신라이사부독도참치),"It is a store with takeout and delivery available, where you can taste good quality raw fish. This restaurant's signature menu is sliced raw tuna. This seafood restaurant is located in Gangneung-si, Gangwon-do.",http://tong.visitkorea.or.kr/cms/resource/07/2670907_image2_1.jpg,"67, Sorol-ro, Gangneung-si, Gangwon-do",128.8786733988,37.7681358742,store takeout delivery available taste quality raw fish restaurants signature menu sliced raw tuna seafood restaurant gangneungsi gangwondo,"['food', 'raw', 'takeout', 'delivery', 'tuna', 'quality']",food
