,contentid,contenttypeid,title,overview,firstimage,addr1,mapx,mapy,tags,tokens,contenttypeid_tag
177,264480,76,Eulji Observatory (을지전망대),"Eulji Observatory, located near the Military Demarcation Line along the ridge of Gachilbong Peak, is now one of the most informative sites dating back to the Korean War. From Eulji Observatory, visitors can see North Korean land from afar as well as Birobong Peak of Geumgangsan Mountain. It is the northernmost DMZ attraction and over 100,000 people visit this observation platform every year.",http://tong.visitkorea.or.kr/cms/resource/91/2659891_image2_1.jpg,"621, Hu-ri, Haean-myeon, Yanggu-gun, Gangwon-do",128.1452571178,38.2901915991,eulji observatory military demarcation line ridge gachilbong peak informative sites dating back korean war eulji observatory visitors see north korean land afar birobong peak geumgangsan mountain northernmost dmz attraction people observation platform year,"['nature', 'eulji', 'observatory', 'peak', 'informative', 'demarcation']",nature
178,1407491,78,Festival Theater Mime (축제극장 몸짓),"Festival Theater Mime in Chuncheon, Gangwon-do is a modern four-story performance hall, with one basement floor and three above-ground floors. Believing that human gestures can change the world, the theater features a wide repertoire of inspiring performances involving traditional music, dance, drama and mime.",http://tong.visitkorea.or.kr/cms/resource/50/1836950_image2_1.jpg,"112, Chuncheon-ro, Chuncheon-si, Gangwon-do",127.7276939015,37.8729823203,festival theater mime chuncheon gangwondo modern fourstory performance hall basement floor three aboveground floors believing human gestures change world theater features wide repertoire inspiring performances involving traditional music dance drama mime,"['culture', 'mime', 'theater', 'inspiring', 'believing', 'fourstory']",culture
179,1924853,76,Gachilbong Battlefield (가칠봉지구전투전적지),"The entire 
town of Haean-myeon is contained in Haean Basin. Also known as Punch Bowl, Haean 
Basin is surrounded by high peaks and one of these peaks is Gachilbong. The 
nature of the&nbsp;terrain in the Gachilbong area made it difficult to conduct 
military operations during the Korean War. The North Korean military utilized these natural features to build a solid defense position and launch counterattacks, while the 
South Korean soldiers in the lowland were in a disadvantageous position. South Korean soldiers were under the command of 5th 
Division Commander Brigadier General Min Gi-sik and 24th Regiment Commander 
Colonel Yu Ui-jun. On the North Korean side, the 7th, 14th, and 32nd Regiments of the 
27th Division and the 23rd Regiment of the 12th Division under the  2nd Corps fought back. By 
sending a&nbsp;military deployment and conducting search operations, the 
South Korean military completed a reconnaissance of the area on August 30 and 
advanced to counterattack. On August 31, after defending their position for two 
days, the South Korean soldiers were able to break the North Korean resistance. 
Each unit secured a strongly fortified position to&nbsp;draw the North Korean 
soldiers out. Thereafter, South Korea launched an all-out attack and captured&nbsp;Hill 
1241. However, North Korea attacked again and South Korea retreated. After several attacks and counterattacks, 
South Korea was able to take back Gachilbong and the surrounding areas. Although 
it&nbsp;resulted in heavy casualties on both sides, this battle ultimately 
gave South Korea possession of Haean Basin.",http://tong.visitkorea.or.kr/cms/resource/61/2495061_image2_1.jpg,"Haean-myeon, Yanggu-gun, Gangwon-do",128.1310206162,38.254851006,entire town haeanmyeon contained haean basin known punch bowl haean basin surrounded high peaks peaks gachilbong nature thenbspterrain gachilbong made difficult conduct military operations korean war north korean military utilized natural features build solid defense position launch counterattacks south korean soldiers lowland disadvantageous position south korean soldiers command th division commander brigadier general min gisik th regiment commander colonel yu uijun north korean side th th nd regiments th division rd regiment th division nd corps fought back sending anbspmilitary deployment conducting search operations south korean military completed reconnaissance august advanced counterattack august defending position days south korean soldiers able break north korean resistance unit secured strongly fortified position tonbspdraw north korean soldiers thereafter south launched allout attack capturednbsphill however north attacked south retreated several attacks counterattacks south able take back gachilbong surrounding areas although itnbspresulted heavy casualties sides battle ultimately gave south possession haean basin,"['nature', 'south', 'th', 'position', 'soldiers', 'haean']",nature
180,2710532,80,Gajae Wa Gom Pension [Korea Quality] / 가재와곰펜션 [한국관광 품질인증/Korea Quality],"This pension is located in the upper region of Heungjeong Valley in Bongpyeong-myeon, Pyeongchang-gun, Gangwon-do. As befitting its location deep in the mountain, the Gajae Wa Gom Pension is housed in a log house with a gentle scent of wood thanks to its wooden interior. 
There are 4 units available for rental, with only the Hwangto Room being single-story. All other units are housed in two-story buildings. Gajae and Wa units are 116 m2-sized two-story units that have a standard occupancy of 6 and a maximum of 10. The first floor has a living room, ondol (under-the-floor heating system) room, a kitchen, and a restroom, while the second floor has a bedroom and a restroom. Gom unit is 132 m2-wide and has a bedroom on the first floor, and an attic on the second floor. It has a standard occupancy of 8 and a maximum of 12. Hwangto Room, which is heated with a traditional furnace, is a building with a maximum occupancy of 4, made out of a kitchen-living room and a restroom. All units have terraces for barbecue. Facilities on site include the valleyside bungalow, karaoke machine, and a foot volleyball field. The rest area is decorated like a cafe, and offers free coffee and tea.",http://tong.visitkorea.or.kr/cms/resource/06/2707806_image2_1.jpg,"212-27, Heungjeonggyegok 4-gil, Pyeongchang-gun, Gangwon-do",128.3109751158,37.6609429108,pension upper region heungjeong valley bongpyeongmyeon pyeongchanggun gangwondo befitting location deep mountain gajae wa gom pension housed log house gentle scent wood thanks wooden interior units available rental hwangto room singlestory units housed twostory buildings gajae wa units msized twostory units occupancy maximum first floor living room ondol underthefloor heating system room kitchen restroom second floor bedroom restroom gom unit mwide bedroom first floor attic second floor occupancy maximum hwangto room heated traditional furnace building maximum occupancy made kitchenliving room restroom units terraces barbecue facilities valleyside bungalow karaoke machine foot volleyball field rest decorated cafe free coffee tea,"['accommodation', 'units', 'maximum', 'occupancy', 'restroom', 'room']",accommodation
181,2693664,82,Gallery Sopung (갤러리소풍),"Creamy seafood spaghetti with savory cream sauce is a popular menu item. This Western dishes restaurant is located in Gangneung-si, Gangwon-do. The representative menu is pork cutlet.",http://tong.visitkorea.or.kr/cms/resource/89/2684789_image2_1.jpg,"49-1, Gangneung-daero, 587beon-gil, Gangneung-si, Gangwon-do",128.9159750087,37.787006641,creamy seafood spaghetti savory cream sauce popular menu item western dishes restaurant gangneungsi gangwondo representative menu pork cutlet,"['food', 'item', 'creamy', 'spaghetti', 'savory', 'cream']",food
182,2693622,82,Galmaegi Dabang (갈매기다방),"It is a cafe with an ocean view. The best menu at this restaurant is waffle. This cafe is located in Gangneung-si, Gangwon-do.",http://tong.visitkorea.or.kr/cms/resource/78/2684778_image2_1.jpg,"63, Yeongjin-gil, Yeongok-myeon, Gangneung-si, Gangwon-do",128.8430040037,37.870373343,cafe ocean view best menu restaurant waffle cafe gangneungsi gangwondo,"['food', 'cafe', 'waffle', 'ocean', 'best', 'view']",food
183,2693613,82,Gamasot Seolleongtang (가마솥설렁탕),"You can enjoy Seolleongtang (ox bone soup) with lots of Korean beef. This restaurant's signature menu is ox none soup. This Korean dishes restaurant is located in Gangneung-si, Gangwon-do.",http://tong.visitkorea.or.kr/cms/resource/74/2684774_image2_1.jpg,"7, Imyeong-ro, 140beon-gil, Gangneung-si, Gangwon-do",128.89286144,37.7541960969,seolleongtang ox bone soup lots korean beef restaurants signature menu ox none soup korean dishes restaurant gangneungsi gangwondo,"['food', 'ox', 'soup', 'seolleongtang', 'none', 'bone']",food
184,2673353,82,Gamjabau Sikdang (감자바우식당),"As a place introduced in a lot of Korean gourmet programs, it is a restaurant that sells local dishes in Gangwon-do. The best menu at this restaurant is potato ball soup. This Korean dishes restaurant is located in Gangneung-si, Gangwon-do.",http://tong.visitkorea.or.kr/cms/resource/12/2670912_image2_1.jpg,"4, Geumseong-ro 35beon-gil, Gangneung-si, Gangwon-do",128.8970944271,37.7530768644,place introduced lot korean gourmet programs restaurant local dishes gangwondo best menu restaurant potato ball soup korean dishes restaurant gangneungsi gangwondo,"['food', 'restaurant', 'potato', 'ball', 'introduced', 'gourmet']",food
185,2693650,82,Gangchon (강촌),"It is a place where you can enjoy Korean BBQ. This Korean dishes restaurant is located in Gangneung-si, Gangwon-do. The representative menu is grilled black pork.",http://tong.visitkorea.or.kr/cms/resource/87/2684787_image2_1.jpg,"1, Yongjigak-gil, 8beon-gil, Gangneung-si, Gangwon-do",128.9049990344,37.7607066913,place korean bbq korean dishes restaurant gangneungsi gangwondo representative menu grilled black pork,"['food', 'black', 'bbq', 'pork', 'korean', 'grilled']",food
186,1998468,75,Gangchon Rail Park (Gimyujeong Railbike) (강촌레일파크 (김유정레일바이크)),"After Gyeongchun Subway Line opened, the old train tracks turned into a rail bike park. Gangchon Rail Park starts next to Gimyujeong Station and offers various attractions including large book photo zone, café, zipwire and more. The total course of the rail bike is 8.5 kilometers long with 6 kilometers on rail bike and last 2.5 kilometers on a train. Most of the track is downhill for an easy ride with a beautiful view of mountains, fields, and a river. With an additional fee, visitors can enjoy the VR experience section of the ride. After riding the final section on a train along the Bukhangang River, riders will take the shuttle bus back to the original location. There are also a 7.2-kilometer-long Gyeonggang Railbike that starts from Gyeonggang Station at a separate charge.",,"1383, Gimyujeong-ro, Chuncheon-si, Gangwon-do",127.7121497907,37.8157136906,gyeongchun subway line opened old train tracks turned rail bike park gangchon rail park starts next gimyujeong station attractions large book photo zone caf zipwire total course rail bike kilometers long kilometers rail bike last kilometers train track downhill easy ride beautiful view mountains fields river additional fee visitors vr experience section ride riding final section train bukhangang river riders take shuttle bus back original location kilometerlong gyeonggang railbike starts gyeonggang station separate charge,"['activity', 'rail', 'bike', 'train', 'gyeonggang', 'kilometers']",activity
187,264436,76,Gangchon Resort (강촌유원지),"The Gangchon Resort, as one of Chuncheon’s major resorts, stretches along the Bukhangang River and the Gangchoncheon Stream. It offers splendid scenery and many neighboring tourist attractions, such as Gugok Falls, Deungseon Falls, and Samaksan Mountain. It has excellent accessibility of public transportation, many theme park facilities, and accommodation facilities, so it has been a popular location for a young people’s membership trip from the 1970s to the 1990s. However, along with the opening of the double-track railway on the Gyeongchun Line in 2010, the Gangchon Station building was relocated and consequently, the number of visitors has decreased and the local business experienced depression. Therefore, there has been a campaign to revitalize Gangchon. Near the former Gangchon Station, the large sculpture “Ddo-ori Gangchon” has been installed, and the reduced-size model of the Deungseongyo Bridge (suspension bridge), which was a famous tourist attraction in the past, has been reproduced. In particular, “Ddo-ori Gangchon,” which is a popular photo zone, was built by embodying the Scaly-side Merganser (Mergus squamatus, Natural Monument No. 448), which come the area of Gangchon in winter. Additionally, the Deungseongyo Bridge, which was Korea’s first suspension bridge, but demolished in 1985, was reproduced as a tourist pedestrian bridge with a length of 58 m. Furthermore, Gangchon Land, which is a well-known theme park, and the activity of four-wheel motorcycle riding along the riverside, are also major tourist attractions in Gangchon.",http://tong.visitkorea.or.kr/cms/resource/65/1850165_image2_1.jpg,"The area of Namsan-myeon, Chuncheon-si, Gangwon-do",127.6325486998,37.8157038798,gangchon resort chuncheons major resorts stretches bukhangang river gangchoncheon stream splendid scenery neighboring tourist attractions gugok falls deungseon falls samaksan mountain excellent accessibility public transportation theme park facilities accommodation facilities popular location young peoples membership trip however opening doubletrack railway gyeongchun line gangchon station building relocated consequently number visitors decreased local business experienced depression therefore campaign revitalize gangchon former gangchon station large sculpture ddoori gangchon installed reducedsize model deungseongyo bridge suspension bridge famous tourist attraction past reproduced particular ddoori gangchon popular photo zone embodying scalyside merganser mergus squamatus natural monument come gangchon winter additionally deungseongyo bridge koreas first suspension bridge demolished reproduced tourist pedestrian bridge length furthermore gangchon land wellknown theme park activity fourwheel motorcycle riding riverside major tourist attractions gangchon,"['nature', 'gangchon', 'bridge', 'reproduced', 'deungseongyo', 'ddoori']",nature
188,349484,80,Gangchon Youth Hostel (강촌 유스호스텔),"Gangchon Youth Hostel offers travelers with a safe and comfortable accomodation at a low cost. The hostel also offers sports facillities, cooking area and more for the convenience of visitors.",http://tong.visitkorea.or.kr/cms/resource/56/588256_image2_1.jpg,"62-9, Gangchongugok-gil, Chuncheon-si, Gangwon-do",127.6299825392,37.8064465748,gangchon youth hostel travelers safe comfortable accomodation low cost hostel sports facillities cooking convenience visitors,"['accommodation', 'hostel', 'accomodation', 'facillities', 'low', 'cost']",accommodation
189,2694680,82,Gangdong Bunsik (강동분식),"It is a place that sells a variety of Jeon (Korean pancake). This Korean dishes restaurant is located in Gangneung-si, Gangwon-do. The most famous menu is buckwheat crepe.",http://tong.visitkorea.or.kr/cms/resource/16/2685016_image2_1.jpg,"15, Gotgamjeon-gil, Gangneung-si, Gangwon-do",128.8976138562,37.7520492159,place variety jeon korean pancake korean dishes restaurant gangneungsi gangwondo famous menu buckwheat crepe,"['food', 'jeon', 'crepe', 'pancake', 'buckwheat', 'korean']",food
190,1891507,76,Gangmun Beach (강문해변),"Located in Gangmun-dong, Gangmun Beach is lined with fresh <em>hoe</em> (sliced raw fish) restaurants along Gangmunhang Port. The beach has accommodations nearby and is in close proximity to the Gyeongpo area, making it a great vacation destination. Not only is the beach a well-known diving spot among scuba divers for its deep waters and abundant marine life, but its dock is also popular among fishers all year round.",,"352, Changhae-ro, Gangneung-si, Gangwon-do",128.9190439335,37.7948530151,gangmundong gangmun beach lined fresh emhoeem sliced raw fish restaurants gangmunhang port beach accommodations nearby close proximity gyeongpo great vacation destination beach wellknown diving spot among scuba divers deep waters abundant marine life dock popular among fishers year round,"['nature', 'beach', 'among', 'gangmun', 'divers', 'gangmundong']",nature
191,2693634,82,Gangmun Haemul Kalguksu (강문해물칼국수),"It is a place where you can enjoy Kalguksu (chopped noodle soup) with fresh seafood and fresh vegetables. This Korean dishes restaurant is located in Gangneung-si, Gangwon-do. The most famous menu is spicy seafood instant noodles.",http://tong.visitkorea.or.kr/cms/resource/83/2684783_image2_1.jpg,"364, Changhae-ro, Gangneung-si, Gangwon-do",128.9172440831,37.7952529338,place kalguksu chopped noodle soup fresh seafood fresh vegetables korean dishes restaurant gangneungsi gangwondo famous menu spicy seafood instant noodles,"['food', 'seafood', 'fresh', 'instant', 'kalguksu', 'chopped']",food
192,2691464,82,Gangmuneohwa Hoetjip (강문어화횟집),"It is a place where you can eat while enjoying the spectacular seaside view. This Korean dishes restaurant is located in Gangneung-si, Gangwon-do. The most famous menu is assorted sliced raw fish.",http://tong.visitkorea.or.kr/cms/resource/45/2684745_image2_1.jpg,"348, Changhae-ro, Gangneung-si, Gangwon-do",128.9187745232,37.794530825,place eat spectacular seaside view korean dishes restaurant gangneungsi gangwondo famous menu assorted sliced raw fish,"['food', 'spectacular', 'seaside', 'assorted', 'eat', 'sliced']",food
193,2693058,82,Gangnamchon (강남촌),"This is a place where you can enjoy Korean pork ribs personally cooked by the owner. This Korean dishes restaurant is located in Gangneung-si, Gangwon-do. The representative menu is grilled spareribs.",http://tong.visitkorea.or.kr/cms/resource/81/2684581_image2_1.jpg,"3, Imyeong-ro, Gangneung-si, Gangwon-do",128.8959504016,37.7428308051,place korean pork ribs personally cooked korean dishes restaurant gangneungsi gangwondo representative menu grilled spareribs,"['food', 'personally', 'spareribs', 'cooked', 'ribs', 'pork']",food
194,2487829,76,Gangneung Boksakkot Village (강릉 복사꽃마을),"Gangneung Boksakkot Village blooms with peach blossoms each spring. The village is criss-crossed by Hacheon and Sillicheon Streams, which can be crossed by log bridges built long ago by the residents. These precious log bridges are sometimes removed for protection during the rainy summer season, and then put back out when the stream level lowers.

Boksakkot Village provides a wonderful glimpse into the rural agricultural lifestyle of Korea. Visitors can pick their own fruit directly from the tree to enjoy right away, as well as make a scarecrow or spread green tea fertilizer around the trees to help them grow. The village is also the venue for an annual peach blossom festival in April, and a scarecrow festival in August.",http://tong.visitkorea.or.kr/cms/resource/46/2480146_image2_1.jpg,"527-3, Sillicheon-ro, Gangneung-si, Gangwon-do",128.7769430008,37.8800570453,gangneung boksakkot village blooms peach blossoms spring village crisscrossed hacheon sillicheon streams crossed log bridges long ago residents precious log bridges sometimes removed protection rainy summer season put back stream level lowers boksakkot village wonderful glimpse rural agricultural lifestyle visitors pick fruit directly tree away make scarecrow spread green tea fertilizer trees help grow village venue annual peach blossom festival april scarecrow festival august,"['nature', 'village', 'boksakkot', 'scarecrow', 'peach', 'log']",nature
195,2693112,82,Gangneung Chamchi (강릉참치),"It is a place where you can enjoy high-quality tuna sashimi. The best menu at this restaurant is sliced raw tuna. This Korean dishes restaurant is located in Gangneung-si, Gangwon-do.",http://tong.visitkorea.or.kr/cms/resource/17/2684717_image2_1.jpg,"74-19, Jeongwon-ro, Gangneung-si, Gangwon-do",128.8740628172,37.7644251024,place highquality tuna sashimi best menu restaurant sliced raw tuna korean dishes restaurant gangneungsi gangwondo,"['food', 'tuna', 'highquality', 'sashimi', 'sliced', 'restaurant']",food
196,1675246,85,Gangneung Coffee Festival (강릉커피축제),"Gangneung Coffee Festival is held every October in Gangneung, the City of Coffee. Various coffee shops from around the country gather to give visitors a taste of their coffee while coffee masters hold seminars providing their knowledge of coffee. Multiple competitions and performances as well as concerts and cultural events are also held.",http://tong.visitkorea.or.kr/cms/resource/76/2769776_image2_1.JPG,"9-1, Gyeonggang-ro 2021beon-gil, Gangneung-si, Gangwon-do",128.8903006749,37.7504520359,gangneung coffee festival held october gangneung city coffee coffee shops country gather give visitors taste coffee coffee masters hold seminars providing knowledge coffee multiple competitions performances concerts cultural events held,"['festival', 'coffee', 'held', 'gangneung', 'masters', 'knowledge']",festival
197,2475947,76,Gangneung Coffee Street (강릉커피거리),"Gangneung in Gangwon-do is the first local district in Korea to host a coffee festival and support coffee artisans as well as promote development of coffee related facilities and contents such as a coffee museum, coffee street, coffee factory, barista academy, and more. With almost all coffee shops in the area roasting their own coffee beans, Gangneung is well-recognized as the ""city of coffee.""",,"20-1, Changhae-ro 14beon-gil, Gangneung-si, Gangwon-do",128.9473504054,37.7726505813,gangneung gangwondo first local district host coffee festival support coffee artisans promote development coffee related facilities contents coffee museum coffee street coffee factory barista academy almost coffee shops roasting coffee beans gangneung wellrecognized city coffee,"['nature', 'coffee', 'gangneung', 'artisans', 'contents', 'roasting']",nature
198,2593982,75,Gangneung Curling Center (강릉컬링센터 (강릉실내빙상장)),"Gangneung Curling Center is an ice skating rink that served as the venue for curling games during 2018 Pyeongchang Winter Olympics. Located on the basement of the curling center, visitors to the ice skating rink can enjoy skating at an affordable price.",,"32, Jonghabundongjang-gil, Gangneung-si, Gangwon-do",128.8925858597,37.7737771598,gangneung curling center ice skating rink served venue curling games pyeongchang winter olympics basement curling center visitors ice skating rink skating affordable price,"['activity', 'curling', 'skating', 'rink', 'ice', 'center']",activity
199,1732325,78,Gangneung Dano Culture Center (강릉단오제전수교육관),"Gangneung Dano Culture Center was opened in 2004 and played an important role in the success of Gangneung Danoje (Dano rite and festival) being designated a UNESCO Intangible Cultural Heritage on November 25, 2005. The center consists of an exhibition hall and a performance hall. Visitors from Korea and abroad can easily learn about the Dano traditions through culture lectures.",,"1, Danojang-gil, Gangneung-si, Gangwon-do",128.89502532,37.7481857234,gangneung dano culture center opened played important role success gangneung danoje dano rite festival designated unesco intangible cultural heritage november center consists exhibition hall performance hall visitors abroad easily learn dano traditions culture lectures,"['culture', 'dano', 'culture', 'gangneung', 'hall', 'played']",culture
200,293063,85,Gangneung Danoje Festival (강릉단오제),The Gangneung Danoje Festival was designated a Masterpiece of the Oral and Intangible Heritage of Humanity by UNESCO in 2005 and Important Intangible Cultural Property No. 13 in 1967. The festival serves to preserve the folk culture of the Joseon dynasty and has been a popular festival since 1975. The festival features media art using video clips and photos to portray the beauty of Danoje through contemporary arts. Various programs are available both online and offline for visitors to enjoy.,,"1, Danojang-gil, Gangneung-si, Gangwon-do",128.8950169869,37.7482134974,gangneung danoje festival designated masterpiece oral intangible heritage humanity unesco important intangible cultural property festival serves preserve folk culture joseon dynasty popular festival festival features media art using video clips photos portray beauty danoje contemporary arts programs available online offline visitors,"['festival', 'festival', 'danoje', 'intangible', 'clips', 'oral']",festival
201,2676150,82,Gangneung Eomjine Kkomakjip (강릉엄지네꼬막집),"It is a restaurant famous for cockles in Gangneung, where celebrities also visit. This restaurant's signature menu is cockle bibimbap. This Korean dishes restaurant is located in Gangneung-si, Gangwon-do.",http://tong.visitkorea.or.kr/cms/resource/85/2671085_image2_1.jpg,"21, Gyeonggang-ro 2255beon-gil, Gangneung-si, Gangwon-do",128.9070486753,37.7663533009,restaurant famous cockles gangneung celebrities restaurants signature menu cockle bibimbap korean dishes restaurant gangneungsi gangwondo,"['food', 'celebrities', 'cockles', 'cockle', 'bibimbap', 'restaurant']",food
