,contentid,contenttypeid,title,overview,firstimage,addr1,mapx,mapy,tags,tokens,contenttypeid_tag
348,626351,76,Jangneung Royal Tomb [UNESCO World Heritage] (영월 장릉(단종) [유네스코 세계문화유산]),"Jangneung is the tomb of Danjong, the 6th king of the Joseon dynasty (r. 
1441-1457). After having the throne taken away by Suyang Daegun, his uncle, Danjong was condemned to exile in Yeongwol County, where he was later murdered and his remains were abandoned in 
the Donggang River. When no one else was brave enough to find his body, Eom Heung-do, the governor of Yeongwol Lake, found his body and buried him in the tomb that later became Jangneung, one of 
the royal tombs of the Joseon dynasty. Danjong had been stripped of his title at the time he was exiled. His title was later restored in year 1698, during the reign of King Sukjong, and received his posthumous name Danjong, and thereafter was referred to as King Danjong. 


Jangneung houses such buildings as Jeongjagak, Baesikdansa, Jaesil, Yeongcheon, and Hongsammun, and a history hall with relics of Danjong. The area is surrounded by magnificent pine trees. Since 1967, a religious service called Danjongje is held every year on April 5th, according to the lunar calendar, in commemoration of Danjong.",http://tong.visitkorea.or.kr/cms/resource/25/1990225_image2_1.jpg,"190, Danjong-ro, Yeongwol-gun, Gangwon-do",128.451967907,37.1973824361,jangneung tomb danjong th king joseon dynasty r throne taken away suyang daegun uncle danjong condemned exile yeongwol county later murdered remains abandoned donggang river else brave enough find body eom heungdo governor yeongwol lake found body buried tomb later became jangneung royal tombs joseon dynasty danjong stripped title time exiled title later restored year reign king sukjong received posthumous danjong thereafter referred king danjong jangneung houses buildings jeongjagak baesikdansa jaesil yeongcheon hongsammun history hall relics danjong surrounded magnificent pine trees religious service called danjongje held year april th according lunar calendar commemoration danjong,"['nature', 'danjong', 'jangneung', 'later', 'king', 'title']",nature
349,2694549,82,Jangsu Gimbap (장수김밥),"It is a place where you can enjoy various types of gimbap. This Korean dishes restaurant is located in Gangneung-si, Gangwon-do. The most famous menu is gimbap.",http://tong.visitkorea.or.kr/cms/resource/77/2684977_image2_1.jpg,"149, Imyeong-ro, Gangneung-si, Gangwon-do",128.8917031986,37.7546126928,place types gimbap korean dishes restaurant gangneungsi gangwondo famous menu gimbap,"['food', 'gimbap', 'types', 'famous', 'gangneungsi', 'dishes']",food
350,2654939,82,Jangsu Ttukbaegi (장수뚝배기),"This is a Korean cuisine located in Wonju-si, Gangwon-do. The representative menu is beef blood hangover soup. Seonji haejangguk (hangover soup made with sliced congealed ox blood) is a traditional Korean food.",http://tong.visitkorea.or.kr/cms/resource/38/2652838_image2_1.jpg,"21-1, Geongang-ro, Wonju-si, Gangwon-do",127.9881725261,37.3255478449,korean cuisine wonjusi gangwondo representative menu beef blood hangover soup seonji haejangguk hangover soup made sliced congealed ox blood traditional korean food,"['food', 'hangover', 'blood', 'congealed', 'seonji', 'soup']",food
351,264185,76,Jangsudae Pavilion (장수대),"Jangsudae Pavilion was completed on October 1, 1959 to commemorate the great victory of the battle held at Seoraksan Mountain during the Korean War. It serves as a resting spot for visitors who hike up the park to visit attractions nearby such as the Daeseung Falls, Oknyeotang Spring, Gamatang Spring, Hangyesanseong Fortress, and Haneulbyeok Wall. The pavilion is built in a traditional Korean style and considered as an excellent hermitage in terms of both structure and size. The surrounding nature consisting of mountain cliffs and pine forest makes the building stand out even more.",http://tong.visitkorea.or.kr/cms/resource/08/1583408_image2_1.jpg,"4193, Seorak-ro, Inje-gun, Gangwon-do",128.3418528071,38.1194236071,jangsudae pavilion completed october commemorate great victory battle held seoraksan mountain korean war serves resting spot visitors hike park attractions nearby daeseung falls oknyeotang spring gamatang spring hangyesanseong fortress haneulbyeok wall pavilion traditional korean style considered excellent hermitage terms structure size surrounding nature consisting mountain cliffs pine forest makes building stand even,"['nature', 'pavilion', 'spring', 'oknyeotang', 'haneulbyeok', 'daeseung']",nature
352,921788,82,Jasmine (쟈스민),"Since opening in 1999, the owner of Jasmine has been the talk of the town because of his good nature. He had been featured in the local newspapers for his good deeds, such as providing food to neighbors in need and offering scholarship money to students from unprevileged families, with the belief that people should share even in general tough times. 

The owner is very enthusiastic about serving customers the right way. He even hired a Chinese cook for tourists from China and Taiwan who came to Chuncheon because of Hallyu, or the Korean wave. In addition to authentic Chinese dishes for Chinese customers, the restaurant also serves other types of Chinese dishes that suit the tastes of Koreans. With the management philosophy that fresh ingredients are a must in bringing out the best flavor, the restaurant owner uses seafood from Mokpo and vegetables from Chuncheon in preparing delicious Chinese dishes for customers. The owner even holds a meeting every morning with the staff to provide better dishes and service.",http://tong.visitkorea.or.kr/cms/resource/57/816857_image2_1.jpg,"14, Umuk-gil 74beon-gil, Chuncheon-si, Gangwon-do",127.7243832801,37.8666496618,opening jasmine talk town nature featured local newspapers deeds providing food neighbors need offering scholarship money students unprevileged families belief people share even general tough times enthusiastic serving customers even hired chinese cook tourists china taiwan came chuncheon hallyu korean wave addition authentic chinese dishes chinese customers restaurant serves types chinese dishes suit tastes koreans management philosophy fresh ingredients must bringing best flavor restaurant uses seafood mokpo vegetables chuncheon preparing delicious chinese dishes customers even holds meeting morning staff provide better dishes service,"['food', 'chinese', 'customers', 'even', 'dishes', 'chuncheon']",food
353,2694326,82,Jeil Gangsan (제일강산),"It is Samgyetang (Korean ginseng chicken soup), one of Korea’s healthy foods. This Korean dishes restaurant is located in Gangneung-si, Gangwon-do. The most famous menu is ginseng chicken soup.",http://tong.visitkorea.or.kr/cms/resource/32/2684932_image2_1.jpg,"29, Hongje-ro 85beon-gil, Gangneung-si, Gangwon-do",128.8811569629,37.753418181,samgyetang korean ginseng chicken soup koreas healthy foods korean dishes restaurant gangneungsi gangwondo famous menu ginseng chicken soup,"['food', 'ginseng', 'chicken', 'soup', 'samgyetang', 'foods']",food
354,2694990,82,Jejudoyaji (제주도야지),"It is a place where you can enjoy Korean BBQ using pork from Jeju. The best menu at this restaurant is grilled skin-on pork belly. This Korean dishes restaurant is located in Wonju-si, Gangwon-do.",http://tong.visitkorea.or.kr/cms/resource/66/2701366_image2_1.jpg,"189-10, Sinjijeong-ro, Wonju-si, Gangwon-do",127.8767478705,37.3727847611,place korean bbq using pork jeju best menu restaurant grilled skinon pork belly korean dishes restaurant wonjusi gangwondo,"['food', 'pork', 'jeju', 'skinon', 'belly', 'bbq']",food
355,2818140,80,Jeong Gwan Ru (Annex Condo) [Korea Quality] / 호텔정관루별관(콘도별장) [한국관광 품질인증],"Jeong Gwan Ru is the only accommodation on Nami Island, a popular tourist attraction in Chuncheon, Gangwon-do Province. A special treat that you can get in this place is a view of starry night sky and wet fog surrounding the island early in the morning, which you can enjoy in peace after all the day time visitors have left the island. The highlight of this place that many guests enjoy is an early morning walk in the quiet and peaceful Nami Island. Since the hotel is located inside an island, you have to park the car in Gapyeongnaru Parking Lot before you make the way to the accommodation. Once you get off the ferry at Nami Island Wharf, you can arrive conveniently via the shuttle bus waiting at the wharf.
Jeong Gwan Ru is largely divided into the main and annex condos. The annex condo stretches along the west riverside of Nami Island. It is a condominium that can accommodate a group of two to ten guests. Unlike the guest rooms in the main area, the guest rooms are self-contained with a kitchen and cooking utensils. Jeong Gwan Ru has a clean zone system that follows strict COVID-19 protocols to ensure safe and pleasant stays for the guests.",http://tong.visitkorea.or.kr/cms/resource/34/2815934_image2_1.jpg,"1, Namiseom-gil, Namsan-myeon, Chuncheon-si, Gangwon-do",127.5261035858,37.7901159965,jeong gwan ru accommodation nami island popular tourist attraction chuncheon gangwondo province special treat get place view starry night sky wet fog surrounding island early morning peace day time visitors left island highlight place guests early morning walk quiet peaceful nami island hotel inside island park car gapyeongnaru parking lot make accommodation get ferry nami island wharf arrive conveniently via shuttle bus waiting wharf jeong gwan ru largely divided main annex condos annex condo stretches west riverside nami island condominium accommodate group ten guests unlike guest rooms main guest rooms selfcontained kitchen cooking utensils jeong gwan ru clean zone system follows strict covid protocols ensure safe pleasant stays guests,"['accommodation', 'island', 'nami', 'gwan', 'ru', 'jeong']",accommodation
356,2818155,80,Jeong Gwan Ru (Main Condo) [Korea Quality] /  호텔정관루본관 [한국관광 품질인증],"Jeong Gwan Ru is the only accommodation on Nami Island, a popular tourist attraction in Chuncheon, Gangwon-do Province. A special treat that you can get in this place is a view of starry night sky and wet fog surrounding the island early in the morning, which you can enjoy in peace after all the day time visitors have left the island. The highlight of this place that many guests enjoy is an early morning walk in the quiet and peaceful Nami Island. Since the hotel is located inside an island, you have to park the car in Gapyeongnaru Parking Lot before you make the way to the accommodation. Once you get off the ferry at Nami Island Wharf, you can arrive conveniently via the shuttle bus waiting at the wharf.
Jeong Gwan Ru is largely divided into the main and annex condos. The main condo is an ilustration art hotel. The guest rooms are the only rooms in the world decorated with artworks from the world’s top painters, craftsmen, and writers including the winners of Nami Concours, an international picture book illustration concours. There are 44 guest rooms of different sizes. There are double rooms and four-person rooms. The guests can choose between ondol rooms and rooms with beds. Jeong Gwan Ru has a clean zone system that follows strict COVID-19 protocols to ensure safe and pleasant stays for the guests.",http://tong.visitkorea.or.kr/cms/resource/89/2815889_image2_1.jpg,"1, Namiseom-gil, Namsan-myeon, Chuncheon-si, Gangwon-do,",127.5260757877,37.790910348,jeong gwan ru accommodation nami island popular tourist attraction chuncheon gangwondo province special treat get place view starry night sky wet fog surrounding island early morning peace day time visitors left island highlight place guests early morning walk quiet peaceful nami island hotel inside island park car gapyeongnaru parking lot make accommodation get ferry nami island wharf arrive conveniently via shuttle bus waiting wharf jeong gwan ru largely divided main annex condos main condo ilustration art hotel guest rooms rooms world decorated artworks worlds top painters craftsmen writers winners nami concours international picture book illustration concours guest rooms different sizes double rooms fourperson rooms guests choose ondol rooms rooms beds jeong gwan ru clean zone system follows strict covid protocols ensure safe pleasant stays guests,"['accommodation', 'island', 'rooms', 'nami', 'gwan', 'ru']",accommodation
357,2692764,82,Jeongane Matjip (정아네맛집),"It is a place that boasts of health with herbs and seafood you can enjoy. This Korean dishes restaurant is located in Gangneung-si, Gangwon-do. The most famous menu is spicy braised chicken.",http://tong.visitkorea.or.kr/cms/resource/57/2684557_image2_1.jpg,"64, Okga-ro, Gangneung-si, Gangwon-do",128.9006854944,37.7619814598,place boasts health herbs seafood korean dishes restaurant gangneungsi gangwondo famous menu spicy braised chicken,"['food', 'herbs', 'health', 'braised', 'boasts', 'chicken']",food
358,2694314,82,Jeongdam (정담),"It is a place that is ideal for gatherings with a spacious parking lot. This Korean dishes restaurant is located in Gangneung-si, Gangwon-do. The representative menu is whole chicken soup with shingled hedgehog.",http://tong.visitkorea.or.kr/cms/resource/29/2684929_image2_1.jpg,"138-20, Nanseolheon-ro, Gangneung-si, Gangwon-do",128.9088368105,37.785476123,place ideal gatherings spacious parking lot korean dishes restaurant gangneungsi gangwondo representative menu whole chicken soup shingled hedgehog,"['food', 'shingled', 'hedgehog', 'gatherings', 'spacious', 'whole']",food
359,264165,76,Jeongdongjin Beach (정동진해변),"Jeongdongjin Beach is a nice, sandy beach that stretches over 250 meters with three major swimming spots: in front of Jeongdongjin Station, by Sandglass Park, and by the Jeongdongjin Breakwater. The spots near the railway station and by the park are more popular because they are spacious and easy to reach. The numerous rocks in front of Jeongdongjin Station are home to shellfish, mussels, sea urchins and edible seaweed. 
Jeondongjin Station is known to be one of the stations closest to the ocean in the world. It is also a well-known sunrise spot, attracting crowds of sunrise spectators. The Jeongdongjin Sunrise Tourist Train has become a crowd favorite as well, ever since its premier run in 1997.",,"17, Jeongdongyeok-gil, Gangneung-si, Gangwon-do",129.0326591356,37.6914477475,jeongdongjin beach nice sandy beach stretches three major swimming spots jeongdongjin station sandglass park jeongdongjin breakwater spots railway station park popular spacious easy reach numerous rocks jeongdongjin station home shellfish mussels sea urchins edible seaweed jeondongjin station known stations closest ocean world wellknown sunrise spot attracting crowds sunrise spectators jeongdongjin sunrise tourist train become crowd favorite ever premier run,"['nature', 'jeongdongjin', 'station', 'sunrise', 'spots', 'urchins']",nature
360,2694320,82,Jeongdongjin Hanggu Hoe Center (정동진항구회센터),"It is a place where you can enjoy various types of sliced raw fish. The best menu at this restaurant is sliced raw fish. This Korean dishes restaurant is located in Gangneung-si, Gangwon-do.",http://tong.visitkorea.or.kr/cms/resource/30/2684930_image2_1.jpg,"1017, Heonhwa-ro, Gangneung-si, Gangwon-do",129.0366811663,37.6859651257,place types sliced raw fish best menu restaurant sliced raw fish korean dishes restaurant gangneungsi gangwondo,"['food', 'sliced', 'raw', 'fish', 'restaurant', 'types']",food
361,2399001,75,Jeongdongjin Railbike (정동진 레일바이크),"Jeongdongjin Railbike is one of the must-try leisure activities in Gangwon-do. Departing from Jeongdongjin Station, the railbike  brings the cool sea breeze and offers an unobstructed view of the ocean while it runs its course.",http://tong.visitkorea.or.kr/cms/resource/08/2713708_image2_1.jpg,"17, Jeongdongyeok-gil, Gangneung-si, Gangwon-do",129.0327146846,37.6914949653,jeongdongjin railbike musttry leisure activities gangwondo departing jeongdongjin station railbike brings cool sea breeze unobstructed view ocean runs course,"['activity', 'railbike', 'jeongdongjin', 'musttry', 'departing', 'breeze']",activity
362,2682886,76,Jeongdongjin Station (정동진역),"Jeongdongjin Station is known as the train station located closest to the ocean in the nation. Built in 1962, the area had as many as 5,000 people during the mining period, but decreased into a small fishing village of under 2,000 after the government's coal industry reform policies went into action. In the early 1990s the train rarely stopped at the station due to minimal passengers, but it gained popularity after appearing in the drama “Sandglass (1995)” and is also widely famous for its sunrise view. The Sunrise Train, a six-hour course from Cheongnyangni Station to Jeongdongjin Station, was added to accommodate more visitors. Other attractions nearby include Jeongdongjin Beach, hourglass tree and more.",http://tong.visitkorea.or.kr/cms/resource/09/2713709_image2_1.jpg,"17, Jeongdongyeok-gil, Gangneung-si, Gangwon-do",129.0327146846,37.6914949653,jeongdongjin station known train station closest ocean nation people mining period decreased small fishing village governments coal industry reform policies went action early train rarely stopped station due minimal passengers gained popularity appearing drama sandglass widely famous sunrise view sunrise train sixhour course cheongnyangni station jeongdongjin station added accommodate visitors attractions nearby jeongdongjin beach hourglass tree,"['nature', 'station', 'train', 'jeongdongjin', 'sunrise', 'action']",nature
363,1117592,85,Jeongdongjin Sunrise Festival (정동진 해맞이 축제),"Many people come to celebrate a fresh start at the Jeongdongjin Sunrise Festival on the eve of one year and the first day of the New Year at Sandglass Park. The sandglass at the park has a diameter of 8.06 meters, a x_width of 3.2 meters, a weight of 40 tons, and holds 8 tons of sand, making it one of the biggest sandglasses in the world. It takes a whole year for sand to trickle to the bottom and then the sandglass restarts again on New Year&rsquo;s Day each year at midnight.<br /><br />Festival events include a fireworks display, the turning of the sandglass to start another year, and performances by various artists.",http://tong.visitkorea.or.kr/cms/resource/20/2576620_image2_1.jpg,"Jeongdongjin2-ri, Gangneung-si, Gangwon-do",129.0083245803,37.7118560243,people come celebrate fresh start jeongdongjin sunrise festival eve year first day new year sandglass park sandglass park diameter xwidth weight tons holds tons sand biggest sandglasses world takes whole year sand trickle bottom sandglass restarts new yearrsquos day year midnightbr br festival events fireworks display turning sandglass start another year performances artists,"['festival', 'sandglass', 'year', 'start', 'tons', 'new']",festival
364,1064021,78,Jeongdongjin Time Museum (정동진시간박물관),"Jeongdongjin Time Museum is comprised of a steam locomotive and 180-meter-long train at the famous Sandglass Park. It features interesting and unique exhibition spaces based on the concept of time. Since its opening in 2013, the museum has been introduced on Korea's major television channels like KBS, MBC, SBS, and YTN as well as Chinese TV programs. In addition, the world's largest hourglass, even recorded in the Guinness Book of Records, is set up at the outside garden. Also, an extremely accurate bronze sundial with a x_height of 7.2 meters is installed in the garden.",http://tong.visitkorea.or.kr/cms/resource/95/2362995_image2_1.jpg,"990-1, Heonhwa-ro, Gangneung-si, Gangwon-do",129.0375032783,37.6871261192,jeongdongjin time museum comprised steam locomotive meterlong train famous sandglass park features interesting unique exhibition spaces based concept time opening museum introduced koreas major television channels kbs mbc sbs ytn chinese tv programs addition worlds largest hourglass even recorded guinness book records set outside garden extremely accurate bronze sundial xheight installed garden,"['culture', 'garden', 'time', 'museum', 'ytn', 'sundial']",culture
365,2694306,82,Jeonggam Neungi Baeksuk (정감이능이백숙),"This restaurant uses neungi for Samgyetang (Korean ginseng chicken soup), one of Korea’s healthy dishes. The best menu at this restaurant is whole chicken soup with whingled hedgehog. This Korean dishes restaurant is located in Gangneung-si, Gangwon-do.",http://tong.visitkorea.or.kr/cms/resource/26/2684926_image2_1.jpg,"89-16, Dunji-gil, Gangneung-si, Gangwon-do",128.9575678864,37.7166544775,restaurant uses neungi samgyetang korean ginseng chicken soup koreas healthy dishes best menu restaurant whole chicken soup whingled hedgehog korean dishes restaurant gangneungsi gangwondo,"['food', 'chicken', 'whingled', 'soup', 'restaurant', 'neungi']",food
366,1865177,76,Jeonggangwon - Traditional Korean Food Culture Experience Center (정강원 (한국전통음식문화체험관)),"Jeonggangwon - Traditional Korean Food Culture Experience Center was established in order to preserve, research, distribute and promote the values and merits of traditional Korean food culture in the world. There are various hands-on facilities for  traditional food culture such as an exhibition hall, cooking room, and a fermentation room. The center is a great place for anyone who wants to learn more about traditional Korean food culture and take part in various experiences.",http://tong.visitkorea.or.kr/cms/resource/14/670814_image2_1.jpg,"2010-13, Geumdanggyegok-ro, Pyeongchang-gun, Gangwon-do",128.4080773896,37.5708801796,jeonggangwon traditional korean food culture experience center established order preserve research distribute promote values merits traditional korean food culture world handson facilities traditional food culture exhibition hall cooking room fermentation room center great place anyone wants learn traditional korean food culture take part experiences,"['nature', 'food', 'culture', 'traditional', 'room', 'distribute']",nature
367,697441,85,Jeongseon Arirang Festival (정선아리랑제),"Jeongseon Arirang Festival is an annual festival usually held in October in an effort to preserve and develop the oldest Arirang in Korea, Jeongseon Arirang, an intangible cultural heritage.<br /><br />Many events and programs are held, with the festival's main event being the performance of Arirang folk song. Variations of Arirang from different regions will also be performed.",,"Bongyang-ri, Jeongseon-gun, Gangwon-do",128.6381513918,37.37725137,jeongseon arirang festival annual festival usually held october effort preserve develop oldest arirang jeongseon arirang intangible cultural heritagebr br events programs held festivals main event performance arirang folk song variations arirang different regions performed,"['festival', 'arirang', 'jeongseon', 'held', 'festival', 'effort']",festival
368,2470352,85,Jeongseon Arirang Performance - Ari Arari (정선아리랑극 아리아라리),"Jeongseon Arirang, a musical performance, takes place at the Jeongseon Arirang Center in Jeongseon on days when the Jeongseon Fifth-day Market is taking place. The musical aims to preserve and promote the local cultural intangible heritage of Jeongseon Arirang. Started in 2018, the musical continues to capture the attention of its audience. The performance tells the story of a Joseon dynasty lumberjack, Gimok, who leaves his wife, Jeongseon, and daughter, Ari, behind while he goes to the capital to work on the construction of Gyeongbokgung Palace. After fifteen years of no contact, Ari heads to Hanyang in search of her father.After arriving at the palace, they realize the importance of their hometown and families. The story is told through ten musical numbers, each pleasing to the ears and the eyes. After the musical, the audience can also take pictures with the performers. As an added bonus, a 5,000 won Arirang Voucher comes with the purchase of every ticket, and can be used throughout Jeongseon.",,"51, Aesan-ro, Jeongseon-gun, Gangwon-do",128.6715234213,37.3763882199,jeongseon arirang musical performance takes place jeongseon arirang center jeongseon days jeongseon fifthday market taking place musical aims preserve promote local cultural intangible heritage jeongseon arirang started musical continues capture attention audience performance tells story joseon dynasty lumberjack gimok leaves wife jeongseon daughter ari behind goes capital work construction gyeongbokgung palace fifteen years contact ari heads hanyang search fatherafter arriving palace realize importance hometown families story told ten musical numbers pleasing ears eyes musical audience take pictures performers added bonus arirang voucher comes purchase ticket used throughout jeongseon,"['festival', 'musical', 'jeongseon', 'arirang', 'ari', 'audience']",festival
