,contentid,contenttypeid,title,overview,firstimage,addr1,mapx,mapy,tags,tokens,contenttypeid_tag
0,2686628,82,1975 Yeonggyeguksu The deungsim(1975영계국수The등심),"It is a restaurant where you can enjoy fresh meat as it is also a butcher’s shop. This Korean dishes restaurant is located in Pyeongchang-gun, Gangwon-do. The representative menu is sausage stew.",http://tong.visitkorea.or.kr/cms/resource/74/2676374_image2_1.jpg,"296, Solbong-ro, Pyeongchang-gun, Gangwon-do",128.6639793137,37.6627744563,restaurant fresh meat butchers shop korean dishes restaurant pyeongchanggun gangwondo representative menu sausage stew,"['food', 'butchers', 'sausage', 'meat', 'pyeongchanggun', 'shop']",food
1,2694940,82,1994 Hyeondae Sutbul Galbi (1994현대숯불갈비),"It is a store that has been around since 1994. This Korean dishes restaurant is located in Wonju-si, Gangwon-do. The representative menu is charcoal-grilled ribs.",http://tong.visitkorea.or.kr/cms/resource/63/2701363_image2_1.jpg,"43-4, Jangmigongwon-gil, Wonju-si, Gangwon-do",127.930371561,37.3469331886,store korean dishes restaurant wonjusi gangwondo representative menu charcoalgrilled ribs,"['food', 'charcoalgrilled', 'ribs', 'store', 'wonjusi', 'representative']",food
2,2694672,82,1bunji Seolleongtang (1번지설렁탕),"This is a place that provides thick broth with rice. The best menu at this restaurant is ox bone soup. This Korean dishes restaurant is located in Gangneung-si, Gangwon-do.",http://tong.visitkorea.or.kr/cms/resource/14/2685014_image2_1.jpg,"1, Nampyeong-gil, Gangneung-si, Gangwon-do",128.8416018082,37.8556583536,place thick broth rice best menu restaurant ox bone soup korean dishes restaurant gangneungsi gangwondo,"['food', 'bone', 'ox', 'broth', 'thick', 'rice']",food
3,2694713,82,365 Mega Bunsik (365 메가분식),"It is a place where you can enjoy it at a good price. This restaurant's signature menu is pork cutlet with cheese. This Korean dishes restaurant is located in Wonju-si, Gangwon-do.",http://tong.visitkorea.or.kr/cms/resource/21/2701321_image2_1.jpg,"2, Hwanggeum-ro, Wonju-si, Gangwon-do",127.9866031563,37.3278419953,place price restaurants signature menu pork cutlet cheese korean dishes restaurant wonjusi gangwondo,"['food', 'cheese', 'cutlet', 'price', 'pork', 'wonjusi']",food
4,1825889,76,365 Safetown (365 세이프타운),"365 Safetown is a one-of-a-kind safety awareness theme park combining  education, entertainment, recreation, and leisure into 
one public park. It is the world’s first edutainment facility  dedicated to teaching the public safety lessons about fire, earthquakes, and other natural disasters.

The park consists of three different areas. The Korea Youth Safety Experience Hall provides a realistic experience of natural disasters through 3D and 4D installations. Challenge World offers a chance to test one’s limits through outdoor experience facilities like the tree track and zip line. Lastly, the Gangwon-do Firefighting Academy is a specialized training center for firefighters.",,"15, Pyeonghwa-gil, Taebaek-si, Gangwon-do",129.0267221911,37.0993713487,safetown oneofakind safety awareness theme park combining education entertainment recreation leisure public park worlds first edutainment facility dedicated teaching public safety lessons fire earthquakes natural disasters park consists three different areas youth safety experience hall realistic experience natural disasters installations challenge world chance test ones limits outdoor experience facilities tree track zip line lastly gangwondo firefighting academy specialized training center firefighters,"['nature', 'safety', 'disasters', 'experience', 'park', 'public']",nature
5,2693602,82,9 Nammaejip (9남매집),"It is a place where Korean beans are made every day. This restaurant's signature menu is rich soybean paste stew. This Korean dishes restaurant is located in Gangneung-si, Gangwon-do.",http://tong.visitkorea.or.kr/cms/resource/70/2684770_image2_1.jpg,"63-2, Chodangwon-gil, Gangneung-si, Gangwon-do",128.9139113072,37.7869677163,place korean beans made day restaurants signature menu rich soybean paste stew korean dishes restaurant gangneungsi gangwondo,"['food', 'soybean', 'beans', 'paste', 'rich', 'stew']",food
6,264439,76,Abai Village (아바이 마을),"Located in Cheongho-dong, Abai Village bears a history of displaced people’s distress. The village was formed by refugees of the Korean War from North Korea, mainly from Hamgyeong-do Province. The word “abai” is a dialect of Hamgyeong-do that means a friendly old man like a grandfather. Visitors to Abai Village can get a sense of displaced people’s life and story, which fade away into a chapter of history. Although it has lost its original appearance now, old shacks without a gate still remain here and there. Mural paintings on the wall show the sentiment of nostalgia about their hometown and express sorrow and hard life of displaced people, who lived from hand to mouth by fishing and doing physical labor. The original houses built by refugees in the village were restored into the Refugee Village at the Sokcho Museum. Abai Village is also known as a filming location for the Korean TV drama Autumn in My Heart, attracting a lot of visitors and becoming a major attraction in Sokcho. The restaurant alley is packed with cafes and North Korean food restaurants serving local dishes such as Hamheung-style cold buckwheat noodles, stuffed squid, and North Korean-style sausage soup.",http://tong.visitkorea.or.kr/cms/resource/73/2711173_image2_1.jpg,"122-1, Cheongho-ro, Sokcho-si, Gangwon-do",128.5949161776,38.2007412589,cheonghodong abai village bears history displaced peoples distress village formed refugees korean war north mainly hamgyeongdo province word abai dialect hamgyeongdo means friendly old man grandfather visitors abai village get sense displaced peoples life story fade away chapter history although lost original appearance old shacks without gate still remain mural paintings wall show sentiment nostalgia hometown express sorrow hard life displaced people lived hand mouth fishing physical labor original houses refugees village restored refugee village sokcho museum abai village known filming location korean tv drama autumn heart attracting lot visitors becoming major attraction sokcho restaurant alley packed cafes north korean food restaurants serving local dishes hamheungstyle cold buckwheat noodles stuffed squid north koreanstyle sausage soup,"['nature', 'abai', 'village', 'displaced', 'hamgyeongdo', 'refugees']",nature
7,2366892,76,Abai Village Ferry (아바이마을 갯배),"Gaetbae (boat without engine) is an exotic means of transportation to cross the Abai Village at the mouth of Cheongchoho Lake. It is a rapid means of traveling between downtown Sokcho and Abai Village along the 50 m-long waterway. This small barge-style boat without an engine can be run by pulling the wire manually. When fixing the solid steel wire on both sides of the waterway and pulling it hard with a hook, a boat moves forward slowly. As there is no boatman, passengers need to work together to move the boat. It takes about 5 min to cross the water by boat. This unique experience still attracts many tourists to Sokcho. Furthermore, it is known as the filming location for the Korean TV drama Autumn in My Heart, so many tourists from Japan and China visit the place.",,"39, Jungangbudu-gil, Sokcho-si, Gangwon-do",128.5922246895,38.2028631815,gaetbae boat without engine exotic means transportation cross abai village mouth cheongchoho lake rapid means traveling downtown sokcho abai village mlong waterway small bargestyle boat without engine run pulling wire manually fixing solid steel wire sides waterway pulling hard hook boat moves forward slowly boatman passengers need work together move boat takes min cross water boat unique experience still attracts tourists sokcho furthermore known filming location korean tv drama autumn heart tourists japan china place,"['nature', 'boat', 'engine', 'pulling', 'wire', 'abai']",nature
8,2813153,76,Alpaca World (알파카월드),"Situated on an area of 363,636-㎡ forest, Alpaca World is the first experiential zoo to be founded in Gangwon-do. Visitors can interact and feed cute alpacas surrounded by the pristine beauty of nature. Alpaca World has made appearances in many television shows, featuring ""the genius alpaca"" and the first alpaca to be born in Korea. The attraction offers many hands-on programs and amenities for the convenience of diverse visitors, ranging from families and couples to school field trips.",http://tong.visitkorea.or.kr/cms/resource/32/2539932_image2_1.jpg,"146-155, Deokjaebat-gil, Hongcheon-gun, Gangwon-do",127.8837032834,37.8276988352,forest alpaca world first experiential zoo founded gangwondo visitors interact feed cute alpacas surrounded pristine beauty nature alpaca world made appearances television featuring genius alpaca first alpaca born attraction handson programs amenities convenience diverse visitors ranging families couples school field trips,"['nature', 'alpaca', 'world', 'first', 'interact', 'appearances']",nature
9,266863,75,Alpensia Casino (알펜시아 카지노),"Alpensia Casino is located in the beautiful natural environment of Alpensia Resort, an official venue of the 2018 PyeongChang Olympics. The casino is an international level casino open all year round and it has games such as Baccarat, Blackjack, Roulette, and Big Wheel, as well as slot machines.",http://tong.visitkorea.or.kr/cms/resource/53/1846753_image2_1.jpg,"325, Solbong-ro, Pyeongchang-gun, Gangwon-do",128.6743702048,37.6575030436,alpensia casino beautiful natural environment alpensia resort official venue pyeongchang olympics casino international level casino open year round games baccarat blackjack roulette big wheel slot machines,"['activity', 'casino', 'alpensia', 'roulette', 'blackjack', 'wheel']",activity
10,1365458,76,Alpensia Ocean 700 (알펜시아 오션700),"Alpensia Resort is a beautiful and exciting resort that offers unique programs unavailable at other resorts. Among their facilities, Alpensia  Ocean 700 suits as the perfect family water park, located on the refreshing highland of Daegwallyeong at an altitude of 700 meters. The water park aims to provide convenient and relaxing facilities in an indoor area where visitors can have fun at any time of the year.",http://tong.visitkorea.or.kr/cms/resource/07/904407_image2_1.jpg,"325, Solbong-ro, Pyeongchang-gun, Gangwon-do",128.6907658364,37.6612362616,alpensia resort beautiful exciting resort unique programs unavailable resorts among facilities alpensia ocean suits perfect family water park refreshing highland daegwallyeong altitude water park aims provide convenient relaxing facilities indoor visitors fun time year,"['nature', 'alpensia', 'resort', 'suits', 'unavailable', 'facilities']",nature
11,1351776,76,Alpensia Resort (알펜시아 리조트),"Alpensia Resort, located approx. 184 kilometers from Seoul in Daegwallyeong, Pyeongchang-gun, Gangwon-do, is a tourism & leisure complex open year round. The resort allows visitors to enjoy the area’s pristine natural beauty throughout each of the four seasons. The name ""Alpensia"" is a combination of the words ""Alpen,"" (German for the Alps), ""Asia,"" and ""Fantasia;"" together they reflect the resort’s scenic view of the ""fantastic Alps of Asia."" The complex boasts a variety of super deluxe luxury accommodations and top-notch leisure facilities such as a 45-hole golf course, convention center, water park and ski slopes. The resort successfully hosted the IBU Biathlon World Cup Pyeongchang in 2008 and boasts excellent ski jump and biathlon facilities, a monorail, cross-country ski slopes, and a large stadium.  After a hard day out on the slopes or golf course, visitors can head to the sky lounge, ecology learning center, or Retail Village shopping mall. The resort is also adjacent to many other tourist attractions such as Odaesan Mountain, Samyang Sheep Ranch, Korea Botanic Garden, Lee Hyo-Seok Memorial Hall, and Herbnara Farm.",,"325, Solbong-ro, Pyeongchang-gun, Gangwon-do",128.6730480942,37.6577640991,alpensia resort approx kilometers seoul daegwallyeong pyeongchanggun gangwondo tourism leisure complex open year round resort allows visitors areas pristine natural beauty throughout four seasons alpensia combination words alpen german alps asia fantasia together reflect resorts scenic view fantastic alps asia complex boasts variety super deluxe luxury accommodations topnotch leisure facilities hole golf course convention center water park ski slopes resort successfully hosted ibu biathlon world cup pyeongchang boasts excellent ski jump biathlon facilities monorail crosscountry ski slopes large stadium hard day slopes golf course visitors head sky lounge ecology learning center retail village shopping mall resort adjacent tourist attractions odaesan mountain samyang sheep ranch botanic garden lee hyoseok memorial hall herbnara farm,"['nature', 'resort', 'biathlon', 'alps', 'slopes', 'ski']",nature
12,1133074,75,Alpensia Ski Resort (알펜시아리조트 스키장),"Alpensia Ski Resort has six slopes for skiers and snowboarders to enjoy. Runs as long as 1.4km provide a dynamic experience for both beginners and experienced skiers and snowboarders. There is also an area exclusively for advanaced snowboarders to practice their skills.  Alpensia is not just for winter enthusiasts; the year-round resort transforms the lower, Apron Area, of the mountain into a 100,000㎡ wild flower garden during summer months.",http://tong.visitkorea.or.kr/cms/resource/99/1985699_image2_1.jpg,"325, Solbong-ro, Daegwallyeong-myeon, Pyeongchang-gun, Gangwon-do",128.6743702048,37.6575030436,alpensia ski resort six slopes skiers snowboarders runs long km provide dynamic experience beginners experienced skiers snowboarders exclusively advanaced snowboarders practice skills alpensia winter enthusiasts yearround resort transforms lower apron mountain wild flower garden summer months,"['activity', 'snowboarders', 'skiers', 'alpensia', 'resort', 'apron']",activity
13,2494805,76,Anheung Jjinppang Village (안흥찐빵마을),"Anheung Jjinppang Village is located along National Highway 42, connecting Seoul and Gangneung. Travelers passing Daegwallyeong on their way to Seoul from the Yeongdong area often stopped here to have a light lunch from old times. Anheung jjinppang (Anheung-style steamed bun) was enough to satisfy their hunger. Over time, Anheung jjinppang has become one of Korea's famous nostalgic snacks.

Jucheongang River, beginning from Taegisan Mountain and flowing through Yeongwol, offers the proper humid condition perfect for the bun's aging process. As of now, there are over 10 shops dedicated to selling steamed buns in the village. Since the early 1990s, over one million people have come to Anheung Jjinppang Village to get these steamed buns which became popular through word-of-mouth. 

Anheung jjinppang is made with high-quality red bean, using the traditional cooking process that creates the homemade flavor, which is immediatedly recognized by the mouth that has become used to instant foods.",http://tong.visitkorea.or.kr/cms/resource/82/1583982_image2_1.jpg,"27, Anheung-ro, Hoengseong-gun, Gangwon-do",128.1560576142,37.4124326159,anheung jjinppang village national highway connecting seoul gangneung travelers passing daegwallyeong seoul yeongdong often stopped light lunch old times anheung jjinppang anheungstyle steamed bun enough satisfy hunger time anheung jjinppang become koreas famous nostalgic snacks jucheongang river beginning taegisan mountain flowing yeongwol proper humid condition perfect buns aging process shops dedicated selling steamed buns village early million people come anheung jjinppang village get steamed buns became popular wordofmouth anheung jjinppang made highquality red bean using traditional cooking process creates homemade flavor immediatedly recognized mouth become used instant foods,"['nature', 'jjinppang', 'anheung', 'buns', 'steamed', 'process']",nature
14,2715510,78,Animation Museum & Toy Robot Studio (춘천 애니메이션박물관&토이로봇관),"Located at the Uiam lakeside, the Animation Museum, which is Korea’s only animation museum, has two floors. On the first floor there is the dimensional exhibition hall introducing the origin, birth, and development of the animation, the kinds of animation, and the Korean animation history, as well as the reproductions of a large robot Taekwon V, and the old comic store. The second floor consists of the world hall displaying the animation trend for each country, diverse animation experience activities, and a special exhibition hall. Visitors can experience making sound effects for an animated film using various tools and dubbing a famous animated film such as Run Honey, and Cloud Bread. The Toy Robot Studio, located next to the Animation Museum, provides various experience programs related to robots. Its interesting robot programs are Spider Robot, Mission Robot, Robot Avatar, Robot Dance, Drone Experience, and so on. Both the Animation Museum and the Toy Robot Studio are equipped with convenient facilities for visitors with the background of Uiamho Lake, such as a cafe and souvenir shop, which sells animation characters and toys. The outdoor space also displays cute animation characters on the lawn where children can play freely.",http://tong.visitkorea.or.kr/cms/resource/20/2672820_image2_1.jpg,"854, Baksa-ro, Chuncheon-si, Gangwon-do",127.6918882316,37.8930876473,uiam lakeside animation museum koreas animation museum floors first floor dimensional exhibition hall introducing origin birth development animation kinds animation korean animation history reproductions large robot taekwon v old comic store second floor consists world hall displaying animation trend country diverse animation experience activities special exhibition hall visitors experience sound effects animated film using tools dubbing famous animated film run honey cloud bread toy robot studio next animation museum experience programs related robots interesting robot programs spider robot mission robot robot avatar robot dance drone experience animation museum toy robot studio equipped convenient facilities visitors background uiamho lake cafe souvenir shop animation characters toys outdoor space displays cute animation characters lawn children play freely,"['culture', 'animation', 'robot', 'museum', 'film', 'experience']",culture
15,1891502,76,Anmok Beach (안목해변),"Anmok Beach spans over 500 meters in length and covers an area of 20,000 square meters. The beach is often packed with families on vacation. Right in front of the beach is Anmokhang Port, where around 23 fishing boats can be moored to unload their catch of seaweed in the spring; flatfish, squid, and octopus in the summer; and sailfin sandfish, and pollack in the fall and winter. The place has also become more popular since the main street along the beach earned the reputation as a ""coffee street.""",,"20-1, Changhae-ro 14beon-gil, Gangneung-si, Gangwon-do",128.9473504054,37.7726505813,anmok beach spans length covers square beach often packed families vacation beach anmokhang port fishing boats moored unload catch seaweed spring flatfish squid octopus summer sailfin sandfish pollack fall winter place become popular main street beach earned reputation coffee street,"['nature', 'beach', 'street', 'sailfin', 'moored', 'sandfish']",nature
16,2694179,82,Anmokhang Mulhoe (안목항물회),"It is a place where you can enjoy various types of sashimi. This restaurant's signature menu is cold raw fish soup. This Korean dishes restaurant is located in Gangneung-si, Gangwon-do.",http://tong.visitkorea.or.kr/cms/resource/87/2684887_image2_1.jpg,"2609, Gyeonggang-ro, Gangneung-si, Gangwon-do",128.9451339191,37.7732754657,place types sashimi restaurants signature menu cold raw fish soup korean dishes restaurant gangneungsi gangwondo,"['food', 'sashimi', 'cold', 'raw', 'types', 'soup']",food
17,1064078,75,Aranaby Zipline (아라나비(스카이 어촌체험)),"As “Ara” means ocean and ""naby"" means butterfly in Korean, Aranaby conveys an image of butterflies flying over the ocean. Aranaby Zipline offers a zipline from18 meter-high tower and flies 300 meters across the ocean. <BR>Popular as an eco-tourism activity in diverse countries from the United States to Australia and European countries, ziplines can be enjoyed year-round by people of various ages. Visitors can be assured of their safety as the company has already applied for two patents related to safety, passed safety tests required by the Korea Transportation Safety Authority, and offers a comprehensive liability insurance package.<BR>There are many attractions nearby including Namhangjin Beach, trekking course, Anmok Coffee Street and more.",,"35-7, Gonghang-gil 127beon-gil, Gangneung-si, Gangwon-do",128.9515529876,37.766754123,ara means ocean naby means butterfly korean aranaby conveys image butterflies flying ocean aranaby zipline zipline meterhigh tower flies across ocean brpopular ecotourism activity diverse countries united states australia european countries ziplines enjoyed yearround people ages visitors assured safety company already applied patents related safety passed safety tests required transportation safety authority comprehensive liability insurance packagebrthere attractions nearby namhangjin beach trekking course anmok coffee street,"['activity', 'safety', 'aranaby', 'zipline', 'countries', 'ocean']",activity
18,2695004,82,Arirang Food (아리랑 푸드),"It is a place where you can eat naengmyeon (Korean cold noodle) and meat together. This Korean dishes restaurant is located in Wonju-si, Gangwon-do. The representative menu is cold buckwheat noodles.",http://tong.visitkorea.or.kr/cms/resource/68/2701368_image2_1.jpg,"153-60, Sinjijeong-ro, Wonju-si, Gangwon-do",127.8800669611,37.3746512734,place eat naengmyeon korean cold noodle meat together korean dishes restaurant wonjusi gangwondo representative menu cold buckwheat noodles,"['food', 'cold', 'naengmyeon', 'meat', 'together', 'noodle']",food
19,2817223,78,ARTE Museum Valley Gangneung (아르떼뮤지엄 강릉),"ARTE Museum Valley Gangneung, located by Gyeongpo Lake, is the third immersive media art exhibition presented by d&rsquo;strict, a digital media design company. There are twelve media art exhibitions centered on the theme &ldquo;Valley&rdquo; to reflect the regional characteristics of Gangwon-do and Gangneung, the center of the Baekdu Mountain Range. The works produced under the theme of &ldquo;Eternal Nature&rdquo; have vibrant visuals, sensual sounds, and elegant fragrance adding to the entire experience.",,"131, Nanseolheon-ro, Gangneung-si, Gangwon-do",128.9079034181,37.79008946,arte museum valley gangneung gyeongpo lake third immersive media art exhibition presented drsquostrict digital media design company twelve media art exhibitions centered theme ldquovalleyrdquo reflect regional characteristics gangwondo gangneung center baekdu mountain range works produced theme ldquoeternal naturerdquo vibrant visuals sensual sounds elegant fragrance adding entire experience,"['culture', 'media', 'theme', 'art', 'gangneung', 'baekdu']",culture
20,2499122,79,ARTSHOP IMAGINE NAMI [Korea Quality] / 이매진나미 [한국관광 품질인증],"Located on Nami Island in Chuncheon-si, Gangwon-do, Imagine Nami is a store specializing in handmade crafts. Talented craftsmen based on Nami Island began producing works, and Imagine Nami became the place for selling their works, including various accessories made of leather and natural stones, glass crafts, fabric products, paintings, and other design works. Most artifacts deal with natural themes and stories about Nami Island. The recent collection features various handicrafts containing the image of Snowman, the representative icon of Nami Island, and artifacts include tea cups, candle holders, memo holders, magnets, ceramics, and other decorative interior items. <br />At the entrance, the store sells snacks made by Nami Island&rsquo;s own brands; the other section displays handicrafts from Nami Island and other handmade artifacts made by external artists, toys, daily goods, and more. The hanok-style store carrying the charm of the island has served as a popular photo zone for visitors. Nami Island is a small island that can be reached via boat, and the boat fare is inclusive of admission to the island. To visit Imagine Nami, visitors are required to enter Nami Island; while there, they can enjoy various cultures and convenience facilities.<o:p></o:p>",http://tong.visitkorea.or.kr/cms/resource/54/2633254_image2_1.jpg,"1, Namiseom-gil, Namsan-myeon, Chuncheon-si, Gangwon-do",127.5261035858,37.7901159965,nami island chuncheonsi gangwondo imagine nami store specializing handmade crafts talented craftsmen based nami island began producing works imagine nami became place selling works accessories made leather natural stones glass crafts fabric products paintings design works artifacts deal natural themes stories nami island recent collection features handicrafts containing image snowman representative icon nami island artifacts tea cups candle holders memo holders magnets ceramics decorative interior items br entrance store snacks made nami islandrsquos brands section displays handicrafts nami island handmade artifacts made external artists toys daily goods hanokstyle store carrying charm island served popular photo zone visitors nami island small island reached via boat boat fare inclusive admission island imagine nami visitors required enter nami island cultures convenience facilitiesopop,"['shopping', 'nami', 'island', 'imagine', 'artifacts', 'works']",shopping
